[
  {
    "id": "maxhub-v7-v5550",
    "brand": "MAXHUB",
    "model": "MAXHUB XBoard V7 Series 55” UHD Interactive Display",
    "size": 55,
    "resolution": "3840x2160",
    "os": "Windows 10 IoT / Windows 11 Pro",
    "touchTechnology": "Infrared",
    "features": [
      "4K UHD resolution with high color accuracy (ΔE≤1.5)",
      "90% NTSC wide color gamut",
      "Non-glare technology with 25% haze",
      "Intelligent touchscreen with 50-point touch support",
      "Built-in 3 x 50MP camera system with AI-powered Trident lens",
      "16-microphone array with AI noise reduction and spatial sound",
      "2.1 channel surround sound with 2 × 10W + 20W speakers",
      "BYOM (Bring Your Own Meeting) support",
      "Windows Ink and Direct Annotation support",
      "Palm rejection and handwriting recognition"
    ],
    "warranty": "3 years",
    "priceRange": "$2,598 - $4,390",
    "image": "https://www.fullcompass.com/prod/634047-maxhub-v5550-55-xboard-v7-series-4k-flat-panel-uhd-display",
    "brightness": "350 cd/m²",
    "contrastRatio": "5000:1",
    "viewingAngle": "178°",
    "responseTime": "8 ms",
    "panelLife": "50000 hours",
    "audioOutput": "2 × 10W + 20W Subwoofer",
    "powerConsumption": "Not specified"
  },
  {
    "id": "maxhub-v7-v6550",
    "brand": "MAXHUB",
    "model": "MAXHUB XBoard V7 Series 65” UHD Interactive Display",
    "size": 65,
    "resolution": "3840x2160",
    "os": "Windows 10 IoT / Windows 11 Pro",
    "touchTechnology": "Infrared",
    "features": [
      "4K UHD resolution with high color accuracy (ΔE≤1.5)",
      "90% NTSC wide color gamut",
      "Non-glare technology with 25% haze",
      "Intelligent touchscreen with 50-point touch support",
      "Built-in 3 x 50MP camera system with AI-powered Trident lens",
      "16-microphone array with AI noise reduction and spatial sound",
      "2.1 channel surround sound with 2 × 10W + 20W speakers",
      "BYOM (Bring Your Own Meeting) support",
      "Windows Ink and Direct Annotation support",
      "Palm rejection and handwriting recognition"
    ],
    "warranty": "3 years",
    "priceRange": "$4,121 - $5,044",
    "image": "https://www.fullcompass.com/prod/634047-maxhub-v5550-55-xboard-v7-series-4k-flat-panel-uhd-display",
    "brightness": "350 cd/m²",
    "contrastRatio": "5000:1",
    "viewingAngle": "178°",
    "responseTime": "8 ms",
    "panelLife": "50000 hours",
    "audioOutput": "2 × 10W + 20W Subwoofer",
    "powerConsumption": "Not specified"
  },
  {
    "id": "maxhub-v7-v7550",
    "brand": "MAXHUB",
    "model": "MAXHUB XBoard V7 Series 75” UHD Interactive Display",
    "size": 75,
    "resolution": "3840x2160",
    "os": "Windows 10 IoT / Windows 11 Pro",
    "touchTechnology": "Infrared",
    "features": [
      "4K UHD resolution with high color accuracy (ΔE≤1.5)",
      "90% NTSC wide color gamut",
      "Non-glare technology with 25% haze",
      "Intelligent touchscreen with 50-point touch support",
      "Built-in 3 x 50MP camera system with AI-powered Trident lens",
      "16-microphone array with AI noise reduction and spatial sound",
      "2.1 channel surround sound with 2 × 10W + 20W speakers",
      "BYOM (Bring Your Own Meeting) support",
      "Windows Ink and Direct Annotation support",
      "Palm rejection and handwriting recognition"
    ],
    "warranty": "3 years",
    "priceRange": "$4,949 - $6,865",
    "image": "https://www.fullcompass.com/prod/634031-maxhub-v7550-75-xboard-v7-series-4k-flat-panel-uhd-display",
    "brightness": "350 cd/m²",
    "contrastRatio": "5000:1",
    "viewingAngle": "178°",
    "responseTime": "8 ms",
    "panelLife": "50000 hours",
    "audioOutput": "2 × 10W + 20W Subwoofer",
    "powerConsumption": "Not specified"
  },
  {
    "id": "maxhub-v7-v8650",
    "brand": "MAXHUB",
    "model": "MAXHUB XBoard V7 Series 86” UHD Interactive Display",
    "size": 86,
    "resolution": "3840x2160",
    "os": "Windows 10 IoT / Windows 11 Pro",
    "touchTechnology": "Infrared",
    "features": [
      "4K UHD resolution with high color accuracy (ΔE≤1.5)",
      "90% NTSC wide color gamut",
      "Non-glare technology with 25% haze",
      "Intelligent touchscreen with 50-point touch support",
      "Built-in 3 x 50MP camera system with AI-powered Trident lens",
      "16-microphone array with AI noise reduction and spatial sound",
      "2.1 channel surround sound with 2 × 10W + 20W speakers",
      "BYOM (Bring Your Own Meeting) support",
      "Windows Ink and Direct Annotation support",
      "Palm rejection and handwriting recognition"
    ],
    "warranty": "3 years",
    "priceRange": "$7,262 - $9,178",
    "image": "https://www.fullcompass.com/prod/634009-maxhub-v8650-86-xboard-v7-series-4k-flat-panel-uhd-display",
    "brightness": "350 cd/m²",
    "contrastRatio": "5000:1",
    "viewingAngle": "178°",
    "responseTime": "8 ms",
    "panelLife": "50000 hours",
    "audioOutput": "2 × 10W + 20W Subwoofer",
    "powerConsumption": "Not specified"
  }
]
