[
  {
    "id": "lg-55tr3dk",
    "brand": "Lg",
    "model": "CreateBoard 55TR3DK",
    "size": 55,
    "resolution": "3840x2160",
    "os": "Android 13",
    "touchTechnology": "Infrared",
    "features": [
      "4K UHD resolution",
      "Up to 40 touch points",
      "Google Mobile Services authorized",
      "Google Play Store access",
      "Flicker-free display",
      "Multi-window mode",
      "Picture-in-picture mode",
      "OPS slot support",
      "ConnectedCare DMS"
    ],
    "warranty": "3 years",
    "priceRange": "$2,000 - $3,000",
    "image": "/assets/models/placeholder.png",
    "brightness": "440 cd/m²",
    "ram": "4GB",
    "storage": "32GB",
    "connectivity": [
      "HDMI",
      "VGA",
      "USB-C",
      "USB 3.0",
      "USB 2.0",
      "Audio 3.5mm",
      "RJ45 Gigabit Ethernet",
      "Wi-Fi",
      "Bluetooth",
      "RS-232C",
      "OPS"
    ],
    "series": "CreateBoard TR3DK",
    "certifications": [
      "Google Mobile Services"
    ]
  },
  {
    "id": "lg-65tr3dj",
    "brand": "Lg",
    "model": "Interactive Display 65TR3DJ",
    "size": 65,
    "resolution": "3840x2160",
    "os": "Android",
    "touchTechnology": "Infrared",
    "features": [
      "4K UHD resolution",
      "Up to 20 touch points",
      "1mm gap low parallax",
      "Precise touch and writing experience",
      "OPS slot support",
      "Built-in speakers",
      "LG CreateBoard Share (6 shared screens)",
      "Air Class (up to 30 students)",
      "Embedded Android web browser"
    ],
    "warranty": "3 years",
    "priceRange": "$2,000 - $3,000",
    "image": "/assets/models/placeholder.png",
    "audioOutput": "Built-in speakers",
    "connectivity": [
      "HDMI x3",
      "RGB",
      "Audio In",
      "RS-232C In",
      "RJ45",
      "USB 3.0 Type A x3",
      "USB 2.0 Type A x3",
      "Audio Out",
      "Optical Output",
      "Touch USB x2",
      "Bluetooth"
    ],
    "touchAccuracy": "±1mm",
    "series": "TR3DJ"
  },
  {
    "id": "lg-65tr3dk",
    "brand": "Lg",
    "model": "CreateBoard 65TR3DK",
    "size": 65,
    "resolution": "3840x2160",
    "os": "Android 13",
    "touchTechnology": "Infrared",
    "features": [
      "4K UHD resolution",
      "Up to 40 touch points",
      "Google Mobile Services authorized",
      "Google Play Store access",
      "Flicker-free display",
      "Multi-window mode",
      "Picture-in-picture mode",
      "OPS slot support",
      "ConnectedCare DMS"
    ],
    "warranty": "3 years",
    "priceRange": "$2,000 - $3,000",
    "image": "/assets/models/placeholder.png",
    "brightness": "440 cd/m²",
    "ram": "4GB",
    "storage": "32GB",
    "connectivity": [
      "HDMI",
      "VGA",
      "USB-C",
      "USB 3.0",
      "USB 2.0",
      "Audio 3.5mm",
      "RJ45 Gigabit Ethernet",
      "Wi-Fi",
      "Bluetooth",
      "RS-232C",
      "OPS"
    ],
    "series": "CreateBoard TR3DK",
    "certifications": [
      "Google Mobile Services"
    ]
  },
  {
    "id": "lg-75tr3dj",
    "brand": "Lg",
    "model": "Interactive Display 75TR3DJ",
    "size": 75,
    "resolution": "3840x2160",
    "os": "Android",
    "touchTechnology": "Infrared",
    "features": [
      "4K UHD resolution",
      "Up to 20 touch points",
      "1mm gap low parallax",
      "Precise touch and writing experience",
      "OPS slot support",
      "Built-in speakers",
      "LG CreateBoard Share (6 shared screens)",
      "Air Class (up to 30 students)",
      "Embedded Android web browser"
    ],
    "warranty": "3 years",
    "priceRange": "$2,000 - $3,000",
    "image": "/assets/models/placeholder.png",
    "audioOutput": "Built-in speakers",
    "connectivity": [
      "HDMI x3",
      "RGB",
      "Audio In",
      "RS-232C In",
      "RJ45",
      "USB 3.0 Type A x3",
      "USB 2.0 Type A x3",
      "Audio Out",
      "Optical Output",
      "Touch USB x2",
      "Bluetooth"
    ],
    "touchAccuracy": "±1mm",
    "series": "TR3DJ"
  },
  {
    "id": "lg-75tr3dk",
    "brand": "Lg",
    "model": "CreateBoard 75TR3DK",
    "size": 75,
    "resolution": "3840x2160",
    "os": "Android 13",
    "touchTechnology": "Infrared",
    "features": [
      "4K UHD resolution",
      "Up to 40 touch points",
      "Google Mobile Services authorized",
      "Google Play Store access",
      "Flicker-free display",
      "Multi-window mode",
      "Picture-in-picture mode",
      "OPS slot support",
      "ConnectedCare DMS"
    ],
    "warranty": "3 years",
    "priceRange": "$2,000 - $3,000",
    "image": "/assets/models/placeholder.png",
    "brightness": "440 cd/m²",
    "ram": "4GB",
    "storage": "32GB",
    "connectivity": [
      "HDMI",
      "VGA",
      "USB-C",
      "USB 3.0",
      "USB 2.0",
      "Audio 3.5mm",
      "RJ45 Gigabit Ethernet",
      "Wi-Fi",
      "Bluetooth",
      "RS-232C",
      "OPS"
    ],
    "series": "CreateBoard TR3DK",
    "certifications": [
      "Google Mobile Services"
    ]
  },
  {
    "id": "lg-86tr3dj",
    "brand": "Lg",
    "model": "Interactive Display 86TR3DJ",
    "size": 86,
    "resolution": "3840x2160",
    "os": "Android",
    "touchTechnology": "Infrared",
    "features": [
      "4K UHD resolution",
      "Up to 20 touch points",
      "1mm gap low parallax",
      "Precise touch and writing experience",
      "OPS slot support",
      "Built-in speakers",
      "LG CreateBoard Share (6 shared screens)",
      "Air Class (up to 30 students)",
      "Embedded Android web browser"
    ],
    "warranty": "3 years",
    "priceRange": "$2,000 - $3,000",
    "image": "/assets/models/placeholder.png",
    "audioOutput": "Built-in speakers",
    "connectivity": [
      "HDMI x3",
      "RGB",
      "Audio In",
      "RS-232C In",
      "RJ45",
      "USB 3.0 Type A x3",
      "USB 2.0 Type A x3",
      "Audio Out",
      "Optical Output",
      "Touch USB x2",
      "Bluetooth"
    ],
    "touchAccuracy": "±1mm",
    "series": "TR3DJ"
  },
  {
    "id": "lg-86tr3dk",
    "brand": "Lg",
    "model": "CreateBoard 86TR3DK",
    "size": 86,
    "resolution": "3840x2160",
    "os": "Android 13",
    "touchTechnology": "Infrared",
    "features": [
      "4K UHD resolution",
      "Up to 40 touch points",
      "Google Mobile Services authorized",
      "Google Play Store access",
      "Flicker-free display",
      "Multi-window mode",
      "Picture-in-picture mode",
      "OPS slot support",
      "ConnectedCare DMS"
    ],
    "warranty": "3 years",
    "priceRange": "$2,000 - $3,000",
    "image": "/assets/models/placeholder.png",
    "brightness": "440 cd/m²",
    "ram": "4GB",
    "storage": "32GB",
    "connectivity": [
      "HDMI",
      "VGA",
      "USB-C",
      "USB 3.0",
      "USB 2.0",
      "Audio 3.5mm",
      "RJ45 Gigabit Ethernet",
      "Wi-Fi",
      "Bluetooth",
      "RS-232C",
      "OPS"
    ],
    "series": "CreateBoard TR3DK",
    "certifications": [
      "Google Mobile Services"
    ]
  },
  {
    "id": "lg-98tr3dk",
    "brand": "Lg",
    "model": "CreateBoard 98TR3DK",
    "size": 98,
    "resolution": "3840x2160",
    "os": "Android 13",
    "touchTechnology": "Infrared",
    "features": [
      "4K UHD resolution",
      "Up to 40 touch points",
      "Google Mobile Services authorized",
      "Google Play Store access",
      "Flicker-free display",
      "Multi-window mode",
      "Picture-in-picture mode",
      "OPS slot support",
      "ConnectedCare DMS",
      "350 nit brightness",
      "16/7 runtime"
    ],
    "warranty": "3 years",
    "priceRange": "$2,000 - $3,000",
    "image": "/assets/models/placeholder.png",
    "brightness": "390 cd/m²",
    "ram": "4GB",
    "storage": "32GB",
    "connectivity": [
      "HDMI",
      "VGA",
      "USB-C",
      "USB 3.0",
      "USB 2.0",
      "Audio 3.5mm",
      "RJ45 Gigabit Ethernet",
      "Wi-Fi",
      "Bluetooth",
      "RS-232C",
      "OPS"
    ],
    "series": "CreateBoard TR3DK",
    "certifications": [
      "Google Mobile Services"
    ]
  }
]