[
  {
    "id": "elon-uhd-55",
    "brand": "ELON",
    "model": "ELON 55\u201d UHD Interactive Display",
    "size": 55,
    "resolution": "3840x2160",
    "os": "Android 13",
    "touchTechnology": "Infrared",
    "features": [
      "4K UHD resolution",
      "4mm Tempered Glass",
      "20-point infrared touch",
      "178\u00b0 viewing angle",
      "\u22645ms response time",
      "Touch via finger, pen, or opaque object (\u22655mm)",
      "Built-in 2x10W speakers",
      "Remote control, cable, writing pen, antenna x2, wall mount bracket included"
    ],
    "warranty": "1 year",
    "priceRange": "$366 - $366",
    "image": "/assets/models/elons-smartboard.png",
    "viewingAngle": "178\u00b0",
    "responseTime": "\u22645 ms",
    "audioOutput": "10W x2",
    "powerConsumption": "Not specified"
  },
  {
    "id": "elon-uhd-camera-55",
    "brand": "ELON",
    "model": "ELON 55\u201d UHD Interactive Display (Built-in Camera)",
    "size": 55,
    "resolution": "3840x2160",
    "os": "Android 13",
    "touchTechnology": "Infrared",
    "features": [
      "4K UHD resolution",
      "4mm Tempered Glass",
      "20-point infrared touch",
      "178\u00b0 viewing angle",
      "\u22645ms response time",
      "Touch via finger, pen, or opaque object (\u22655mm)",
      "Built-in 2x10W speakers",
      "Remote control, cable, writing pen, antenna x2, wall mount bracket included",
      "Built-in 48MP camera",
      "Built-in 8-array microphone"
    ],
    "warranty": "1 year",
    "priceRange": "$439 - $439",
    "image": "/assets/models/elons-smartboard.png",
    "viewingAngle": "178\u00b0",
    "responseTime": "\u22645 ms",
    "audioOutput": "10W x2",
    "powerConsumption": "Not specified"
  },
  {
    "id": "elon-uhd-65",
    "brand": "ELON",
    "model": "ELON 65\u201d UHD Interactive Display",
    "size": 65,
    "resolution": "3840x2160",
    "os": "Android 13",
    "touchTechnology": "Infrared",
    "features": [
      "4K UHD resolution",
      "4mm Tempered Glass",
      "20-point infrared touch",
      "178\u00b0 viewing angle",
      "\u22645ms response time",
      "Touch via finger, pen, or opaque object (\u22655mm)",
      "Built-in 2x10W speakers",
      "Remote control, cable, writing pen, antenna x2, wall mount bracket included"
    ],
    "warranty": "1 year",
    "priceRange": "$471 - $471",
    "image": "/assets/models/elons-smartboard.png",
    "viewingAngle": "178\u00b0",
    "responseTime": "\u22645 ms",
    "audioOutput": "10W x2",
    "powerConsumption": "Not specified"
  },
  {
    "id": "elon-uhd-camera-65",
    "brand": "ELON",
    "model": "ELON 65\u201d UHD Interactive Display (Built-in Camera)",
    "size": 65,
    "resolution": "3840x2160",
    "os": "Android 13",
    "touchTechnology": "Infrared",
    "features": [
      "4K UHD resolution",
      "4mm Tempered Glass",
      "20-point infrared touch",
      "178\u00b0 viewing angle",
      "\u22645ms response time",
      "Touch via finger, pen, or opaque object (\u22655mm)",
      "Built-in 2x10W speakers",
      "Remote control, cable, writing pen, antenna x2, wall mount bracket included",
      "Built-in 48MP camera",
      "Built-in 8-array microphone"
    ],
    "warranty": "1 year",
    "priceRange": "$544 - $544",
    "image": "/assets/models/elons-smartboard.png",
    "viewingAngle": "178\u00b0",
    "responseTime": "\u22645 ms",
    "audioOutput": "10W x2",
    "powerConsumption": "Not specified"
  },
  {
    "id": "elon-uhd-75",
    "brand": "ELON",
    "model": "ELON 75\u201d UHD Interactive Display",
    "size": 75,
    "resolution": "3840x2160",
    "os": "Android 13",
    "touchTechnology": "Infrared",
    "features": [
      "4K UHD resolution",
      "4mm Tempered Glass",
      "20-point infrared touch",
      "178\u00b0 viewing angle",
      "\u22645ms response time",
      "Touch via finger, pen, or opaque object (\u22655mm)",
      "Built-in 2x10W speakers",
      "Remote control, cable, writing pen, antenna x2, wall mount bracket included"
    ],
    "warranty": "1 year",
    "priceRange": "$600 - $600",
    "image": "/assets/models/elons-smartboard.png",
    "viewingAngle": "178\u00b0",
    "responseTime": "\u22645 ms",
    "audioOutput": "10W x2",
    "powerConsumption": "Not specified"
  },
  {
    "id": "elon-uhd-camera-75",
    "brand": "ELON",
    "model": "ELON 75\u201d UHD Interactive Display (Built-in Camera)",
    "size": 75,
    "resolution": "3840x2160",
    "os": "Android 13",
    "touchTechnology": "Infrared",
    "features": [
      "4K UHD resolution",
      "4mm Tempered Glass",
      "20-point infrared touch",
      "178\u00b0 viewing angle",
      "\u22645ms response time",
      "Touch via finger, pen, or opaque object (\u22655mm)",
      "Built-in 2x10W speakers",
      "Remote control, cable, writing pen, antenna x2, wall mount bracket included",
      "Built-in 48MP camera",
      "Built-in 8-array microphone"
    ],
    "warranty": "1 year",
    "priceRange": "$672 - $672",
    "image": "/assets/models/elons-smartboard.png",
    "viewingAngle": "178\u00b0",
    "responseTime": "\u22645 ms",
    "audioOutput": "10W x2",
    "powerConsumption": "Not specified"
  },
  {
    "id": "elon-uhd-86",
    "brand": "ELON",
    "model": "ELON 86\u201d UHD Interactive Display",
    "size": 86,
    "resolution": "3840x2160",
    "os": "Android 13",
    "touchTechnology": "Infrared",
    "features": [
      "4K UHD resolution",
      "4mm Tempered Glass",
      "20-point infrared touch",
      "178\u00b0 viewing angle",
      "\u22645ms response time",
      "Touch via finger, pen, or opaque object (\u22655mm)",
      "Built-in 2x10W speakers",
      "Remote control, cable, writing pen, antenna x2, wall mount bracket included"
    ],
    "warranty": "1 year",
    "priceRange": "$823 - $823",
    "image": "/assets/models/elons-smartboard.png",
    "viewingAngle": "178\u00b0",
    "responseTime": "\u22645 ms",
    "audioOutput": "10W x2",
    "powerConsumption": "Not specified"
  },
  {
    "id": "elon-uhd-camera-86",
    "brand": "ELON",
    "model": "ELON 86\u201d UHD Interactive Display (Built-in Camera)",
    "size": 86,
    "resolution": "3840x2160",
    "os": "Android 13",
    "touchTechnology": "Infrared",
    "features": [
      "4K UHD resolution",
      "4mm Tempered Glass",
      "20-point infrared touch",
      "178\u00b0 viewing angle",
      "\u22645ms response time",
      "Touch via finger, pen, or opaque object (\u22655mm)",
      "Built-in 2x10W speakers",
      "Remote control, cable, writing pen, antenna x2, wall mount bracket included",
      "Built-in 48MP camera",
      "Built-in 8-array microphone"
    ],
    "warranty": "1 year",
    "priceRange": "$895 - $895",
    "image": "/assets/models/elons-smartboard.png",
    "viewingAngle": "178\u00b0",
    "responseTime": "\u22645 ms",
    "audioOutput": "10W x2",
    "powerConsumption": "Not specified"
  },
  {
    "id": "elon-uhd-98",
    "brand": "ELON",
    "model": "ELON 98\u201d UHD Interactive Display",
    "size": 98,
    "resolution": "3840x2160",
    "os": "Android 13",
    "touchTechnology": "Infrared",
    "features": [
      "4K UHD resolution",
      "4mm Tempered Glass",
      "20-point infrared touch",
      "178\u00b0 viewing angle",
      "\u22645ms response time",
      "Touch via finger, pen, or opaque object (\u22655mm)",
      "Built-in 2x10W speakers",
      "Remote control, cable, writing pen, antenna x2, wall mount bracket included"
    ],
    "warranty": "1 year",
    "priceRange": "$1,457 - $1,457",
    "image": "/assets/models/elons-smartboard.png",
    "viewingAngle": "178\u00b0",
    "responseTime": "\u22645 ms",
    "audioOutput": "10W x2",
    "powerConsumption": "Not specified"
  },
  {
    "id": "elon-uhd-camera-98",
    "brand": "ELON",
    "model": "ELON 98\u201d UHD Interactive Display (Built-in Camera)",
    "size": 98,
    "resolution": "3840x2160",
    "os": "Android 13",
    "touchTechnology": "Infrared",
    "features": [
      "4K UHD resolution",
      "4mm Tempered Glass",
      "20-point infrared touch",
      "178\u00b0 viewing angle",
      "\u22645ms response time",
      "Touch via finger, pen, or opaque object (\u22655mm)",
      "Built-in 2x10W speakers",
      "Remote control, cable, writing pen, antenna x2, wall mount bracket included",
      "Built-in 48MP camera",
      "Built-in 8-array microphone"
    ],
    "warranty": "1 year",
    "priceRange": "$1,529 - $1,529",
    "image": "/assets/models/elons-smartboard.png",
    "viewingAngle": "178\u00b0",
    "responseTime": "\u22645 ms",
    "audioOutput": "10W x2",
    "powerConsumption": "Not specified"
  }
]