[
  {
    "id": "qeoyo-65-uhd",
    "brand": "Qeoyo",
    "model": "Qeoyo 65” UHD Interactive Flat Panel",
    "size": 65,
    "resolution": "3840x2160",
    "os": "Android 8.0/9.0/11.0 + Windows 10",
    "touchTechnology": "Infrared",
    "features": [
      "4K UHD resolution",
      "Infrared touch with up to 20 points",
      "Dual OS: Android and Windows",
      "Built-in Wi-Fi and Bluetooth",
      "Wireless screen sharing",
      "Integrated whiteboard functionality",
      "Anti-glare 4mm tempered glass",
      "Aluminum alloy frame",
      "Multiple interface options including HDMI, USB, VGA"
    ],
    "warranty": "1 year",
    "priceRange": "$530 - $850",
    "image": "/assets/models/qeoyo-QEOYO75AW.png",
    "brightness": "400 cd/m²",
    "contrastRatio": "Not specified",
    "viewingAngle": "178°",
    "responseTime": "Not specified",
    "panelLife": "Not specified",
    "audioOutput": "Not specified",
    "powerConsumption": "Not specified"
  },
  {
    "id": "qeoyo-75-uhd",
    "brand": "Qeoyo",
    "model": "Qeoyo 75” UHD Interactive Flat Panel",
    "size": 75,
    "resolution": "3840x2160",
    "os": "Android 8.0/9.0/11.0 + Windows 10",
    "touchTechnology": "Infrared",
    "features": [
      "4K UHD resolution",
      "Infrared touch with up to 20 points",
      "Dual OS: Android and Windows",
      "Built-in Wi-Fi and Bluetooth",
      "Wireless screen sharing",
      "Integrated whiteboard functionality",
      "Anti-glare 4mm tempered glass",
      "Aluminum alloy frame",
      "Multiple interface options including HDMI, USB, VGA"
    ],
    "warranty": "1 year",
    "priceRange": "$530 - $850",
    "image": "/assets/models/qeoyo-QEOYO75AW.png",
    "brightness": "400 cd/m²",
    "contrastRatio": "Not specified",
    "viewingAngle": "178°",
    "responseTime": "Not specified",
    "panelLife": "Not specified",
    "audioOutput": "Not specified",
    "powerConsumption": "Not specified"
  },
  {
    "id": "qeoyo-86-uhd",
    "brand": "Qeoyo",
    "model": "Qeoyo 86” UHD Interactive Flat Panel",
    "size": 86,
    "resolution": "3840x2160",
    "os": "Android 8.0/9.0/11.0 + Windows 10",
    "touchTechnology": "Infrared",
    "features": [
      "4K UHD resolution",
      "Infrared touch with up to 20 points",
      "Dual OS: Android and Windows",
      "Built-in Wi-Fi and Bluetooth",
      "Wireless screen sharing",
      "Integrated whiteboard functionality",
      "Anti-glare 4mm tempered glass",
      "Aluminum alloy frame",
      "Multiple interface options including HDMI, USB, VGA"
    ],
    "warranty": "1 year",
    "priceRange": "$530 - $850",
    "image": "/assets/models/qeoyo-QEOYO75AW.png",
    "brightness": "400 cd/m²",
    "contrastRatio": "Not specified",
    "viewingAngle": "178°",
    "responseTime": "Not specified",
    "panelLife": "Not specified",
    "audioOutput": "Not specified",
    "powerConsumption": "Not specified"
  },
  {
    "id": "qeoyo-98-uhd",
    "brand": "Qeoyo",
    "model": "Qeoyo 98” UHD Interactive Flat Panel",
    "size": 98,
    "resolution": "3840x2160",
    "os": "Android 8.0/9.0/11.0 + Windows 10",
    "touchTechnology": "Infrared",
    "features": [
      "4K UHD resolution",
      "Infrared touch with up to 20 points",
      "Dual OS: Android and Windows",
      "Built-in Wi-Fi and Bluetooth",
      "Wireless screen sharing",
      "Integrated whiteboard functionality",
      "Anti-glare 4mm tempered glass",
      "Aluminum alloy frame",
      "Multiple interface options including HDMI, USB, VGA"
    ],
    "warranty": "1 year",
    "priceRange": "$530 - $850",
    "image": "/assets/models/qeoyo-QEOYO75AW.png",
    "brightness": "400 cd/m²",
    "contrastRatio": "Not specified",
    "viewingAngle": "178°",
    "responseTime": "Not specified",
    "panelLife": "Not specified",
    "audioOutput": "Not specified",
    "powerConsumption": "Not specified"
  }
]
